<!ELEMENT repertoire (personne*)>

<!ELEMENT personne (nom, prenom, adresse, telephones, emails)>
<!ATTLIST personne sexe (masculin | feminin) #REQUIRED>

<!ELEMENT nom (#PCDATA)>
<!ELEMENT prenom (#PCDATA)>

<!ELEMENT adresse (numero, voie, codePostal, ville, pays)>
<!ELEMENT numero (#PCDATA)>
<!ELEMENT voie (#PCDATA)>
<!ATTLIST voie type CDATA #REQUIRED>
<!ELEMENT codePostal (#PCDATA)>
<!ELEMENT ville (#PCDATA)>
<!ELEMENT pays (#PCDATA)>

<!ELEMENT telephones (telephone+)>
<!ELEMENT telephone (#PCDATA)>
<!ATTLIST telephone type CDATA #REQUIRED>

<!ELEMENT emails (email+)>
<!ELEMENT email (#PCDATA)>
<!ATTLIST email type CDATA #REQUIRED>
